claim_id,claim,evidence,limitation,what_to_do_next
C1,Accessory genome is the dominant predictive signal,Direction C shows accessory genes often outperform core SNP and Direction O modules rely heavily on accessory features,Core SNP matrix/phylogeny was not the strongest but may still matter for lineage-aware validation,Use accessory as main signal but keep lineage validation as robustness check
C2,One fixed pipeline is not optimal for all antibiotics,Direction O selects different best modules for AMP/AUG/AXO/CHL/FOX,Module selection is based on limited 5-drug original panel,Expand external panel and test learned module-selection rules
C3,Adaptive feature fusion improves original 5-drug performance,Direction O improves F1 in 4/5 drugs compared with paper-ready50 baseline,Not all metrics improve; AUPRC and balanced accuracy changes are mixed,State the claim as F1-focused and report all metrics
C4,Drug metadata helps simulated new-drug generalization,Direction R mean F1 improves from 0.729 genome-only to 0.844 genome+chemical,Only 5 original drugs means chemical generalization is limited,Add more external antibiotics and train a real genome-drug model
C5,External validation supports proof-of-concept beyond original data,Direction T/U/V validate TET/CIP/STR/GEN/NAL using BV-BRC/PATRIC features,External feature space differs from original paper-ready feature space,Build a unified annotation pipeline across original and external data
C6,Leakage checks are present but not final proof,Direction V includes cluster-aware split similarity diagnostic and negative control near balanced accuracy 0.5,Annotation-Jaccard clusters do not fully rule out lineage leakage,Add serovar/cgMLST/SNP-distance/phylogeny-aware split
C7,CIP/NAL need mutation-aware features,Direction W/X identify weak direct quinolone keyword interpretation and mutation-driven resistance risk,Current proxy features are not true mutation calling,Add gyrA/gyrB/parC/parE mutation tokens or AMRFinderPlus/CARD/ResFinder outputs
C8,Biological interpretation needs stronger annotation,Direction E/B show many stable features are unknown or weakly annotated,Keyword matching is not enough for mechanistic claims,Run AMRFinderPlus/CARD/RGI/ResFinder for top features/genomes
